7SEVEN Compatible LG TV Remote Suitable for LG Non Magic Smart tv Remote Control (Mouse & Voice Non-Support) MR20GA Prime Video and Netflix Hotkeys,103,3
"Amazon Brand - Solimo 65W Fast Charging Braided Type C to C Data Cable | Suitable For All Supported Mobile Phones (1 Meter, Black)",NULL,3
SHREENOVA ID116 Plus Bluetooth Fitness Smart Watch for Men Women and Kids Activity Tracker (Black),87,2.8
"Tokdis MX-1 Pro Bluetooth Calling Smartwatch - 1.69â€ LCD Display, Multiple Watch Faces, Sleep Monitor, Heart & SpO2 Monitoring, Multiple Sports Modes, Water Resistant",681,3
Green Tales Heat Seal Mini Food Sealer-Impulse Machine for Sealing Plastic Bags Packaging,24,2.6
IONIX Tap filter Multilayer | Activated Carbon Faucet Water Filters Universal Interface Home Kitchen Faucet Tap Water Clean Purifier Filter Cartridge Five Layer Water Filter-Pack of 1,159,2.9
"Personal Size Blender, Portable Blender, Battery Powered USB Blender, with Four Blades, Mini Blender Travel Bottle for Juice, Shakes, and Smoothies (Pink)",13,2.3
"MR. BRAND Portable USB Juicer Electric USB Juice Maker Mixer Bottle Blender Grinder Mixer,6 Blades Rechargeable Bottle with (Multi color) (MULTI MIXER 6 BLED)",109,2.8
Khaitan ORFin Fan heater for Home and kitchen-K0 2215,2,2
"Nirdambhay Mini Bag Sealer, 2 in 1 Heat Sealer and Cutter Handheld Sealing Machine Portable Bag Resealer Sealer for Plastic Bags Food Storage Snack Fresh Bag Sealer (Including 2 AA Battery)",617,3
